{
  "session_metadata": {
    "session_id": "fibonacci_training_20250906_152621",
    "timestamp": "2025-09-06T15:26:21.756436",
    "duration_seconds": 1397.681146144867,
    "golden_ratio": 1.618033988749,
    "version": "1.0.0"
  },
  "performance_metrics": {
    "avg_response_time_ms": 0,
    "min_response_time_ms": 0,
    "max_response_time_ms": 0,
    "success_rate_percent": 0,
    "total_requests": 0,
    "successful_requests": 0,
    "failed_requests": 0,
    "performance_rating": "poor",
    "improvement_percent": 0,
    "target_progress_percent": 0
  },
  "cache_metrics": {
    "initial_hit_rate_percent": 0,
    "final_hit_rate_percent": 0,
    "hit_rate_improvement": 0,
    "total_hits": 0,
    "total_misses": 0,
    "target_hit_rate_percent": 70
  },
  "fibonacci_analysis": {
    "golden_ratio_efficiency": 0,
    "fibonacci_status": "needs_improvement",
    "optimization_achieved": false,
    "golden_ratio_target": 61.80339887502366
  },
  "phase_results": [],
  "thresholds": {
    "response_time": {
      "excellent_max_ms": 1000,
      "good_max_ms": 5000,
      "poor_min_ms": 10000
    },
    "success_rate": {
      "excellent_min_percent": 95,
      "good_min_percent": 80,
      "poor_max_percent": 50
    },
    "cache": {
      "target_hit_rate_percent": 70,
      "baseline_hit_rate_percent": 10
    },
    "targets": {
      "target_response_time_ms": 35.9,
      "baseline_response_time_ms": 417
    }
  },
  "recommendations": [
    {
      "priority": "medium",
      "category": "cache",
      "description": "Increase cache size using Fibonacci progression",
      "actionable": true,
      "technical_details": "Scale cache size to next Fibonacci number in sequence"
    },
    {
      "priority": "medium",
      "category": "fibonacci",
      "description": "Implement advanced Fibonacci spiral optimization",
      "actionable": false,
      "technical_details": "Research spiral matching algorithms for better cache patterns"
    }
  ],
  "alerts": [
    {
      "severity": "critical",
      "message": "Success rate below acceptable threshold",
      "threshold_breached": "success_rate_critical",
      "current_value": 0,
      "threshold_value": 50
    },
    {
      "severity": "warning",
      "message": "Cache hit rate below target",
      "threshold_breached": "cache_hit_rate_target",
      "current_value": 0,
      "threshold_value": 70
    }
  ]
}